{
  "title": "2025年高教社杯全国大学生数学建模竞赛C题：NIPT的时点选择与胎儿的异常判定",
  "problem_type": [
    "statistical",
    "optimization"
  ],
  "questions": [
    {
      "id": "Q1",
      "statement": "分析男胎Y染色体浓度与检测孕周、孕妇BMI等指标的相关特性，建立关系模型并检验显著性。",
      "required_outputs": [
        "变量相关特性及其统计证据",
        "Y染色体浓度关系模型",
        "模型参数和整体显著性检验",
        "适用于重复检测数据的诊断结果"
      ]
    },
    {
      "id": "Q2",
      "statement": "以男胎最早达到Y染色体浓度4%的时间为目标，按孕妇BMI合理分组，给出各组BMI区间和最佳NIPT时点，使潜在风险最小，并分析检测误差影响。",
      "required_outputs": [
        "BMI分组区间及分组依据",
        "每组最佳NIPT时点",
        "潜在风险目标或损失函数定义",
        "检测误差对分组和时点的敏感性分析"
      ]
    },
    {
      "id": "Q3",
      "statement": "综合身高、体重、年龄等因素、测量误差，以及达到Y染色体浓度4%的比例，按男胎孕妇BMI合理分组并给出各组最佳NIPT时点，使潜在风险最小。",
      "required_outputs": [
        "纳入多因素后的BMI分组方案",
        "各组达到4%的概率或比例随孕周变化的估计",
        "各组最佳NIPT时点及风险依据",
        "检测误差和模型不确定性分析"
      ]
    },
    {
      "id": "Q4",
      "statement": "以女胎13、18、21号染色体非整倍体检测结果为标签，综合X染色体及上述染色体Z值、GC含量、读段数及相关比例、BMI等因素，建立女胎异常判定方法。",
      "required_outputs": [
        "女胎异常判定规则或分类模型",
        "数据质量和缺失值处理规则",
        "分类性能与误判风险评估",
        "可解释的重要判定因素"
      ]
    }
  ],
  "inputs": [
    "男胎检测数据：1082条检测记录、31列",
    "女胎检测数据：605条检测记录、31列，其中Y染色体相关列为空",
    "孕妇基本信息：代码、年龄、身高、体重、BMI、孕次、产次、IVF妊娠方式",
    "检测信息：日期、抽血次数、检测孕周",
    "测序质量信息：原始读段数、比对比例、重复比例、唯一比对读段数、GC含量、过滤比例",
    "染色体信息：13、18、21、X、Y染色体的Z值、浓度或GC含量",
    "标签信息：染色体非整倍体AB列及胎儿是否健康AE列",
    "临床阈值：男胎Y染色体浓度达到或超过4%通常可认为NIPT结果基本准确",
    "临床时窗：10至25周可检测；12周以内、13至27周、28周以后对应递增的发现风险"
  ],
  "outputs": [
    "Q1关系模型与显著性结论",
    "Q2基于BMI的分组和最佳检测时点",
    "Q3综合多因素与达标概率的分组和最佳检测时点",
    "Q4女胎异常判定方法",
    "检测误差、模型不确定性和适用范围说明"
  ],
  "decision_variables": [
    "Q2与Q3的BMI分组边界",
    "Q2与Q3每个BMI组的推荐检测孕周",
    "潜在风险函数中早检失败与延迟发现的权衡参数",
    "Q4异常判定阈值或分类决策规则"
  ],
  "known_constraints": [
    "NIPT通常在孕期10至25周之间检测胎儿性染色体浓度",
    "男胎Y染色体浓度达到或超过4%时，检测结果通常可认为基本准确",
    "女胎不携带Y染色体，附件中女胎Y染色体Z值和浓度为空",
    "较早发现风险较低，13至27周发现风险较高，28周以后风险极高",
    "题目要求Q2和Q3按BMI合理分组并给出各组最佳时点",
    "Q3必须考虑身高、体重、年龄等因素、检测误差及Y染色体浓度达标比例",
    "Q4以女胎13、18、21号染色体非整倍体AB列作为判定结果",
    "同一孕妇可能存在多次抽血、多次检测或同次抽血多次检测"
  ],
  "implicit_constraints": [
    "同一孕妇的多条记录不是独立样本，建模、切分和验证应按孕妇代码处理组内相关性",
    "最早达标时间可能位于两次观测之间，也可能因随访截止而右删失，不能简单等同于首条达标观测",
    "训练集和测试集不得包含同一孕妇的不同记录，以防信息泄漏",
    "BMI分组应兼顾临床可解释性、组内样本量和时点估计稳定性，而不能只追求样本内目标最优",
    "孕周字符串必须统一转换为周加天的连续时间，并核验检测日期与末次月经的逻辑一致性",
    "Q4的分类阈值和性能指标应考虑异常类别稀少及不同误判代价",
    "胎儿出生后健康结果不应在临床检测时不可获得的情况下作为Q4判定输入",
    "原始测序质量异常、缺失或重复记录需要显式处理并保留排除依据"
  ],
  "uncertainties": [
    {
      "item": "题目没有给出潜在风险的精确数学定义及早检失败与延迟发现的相对代价。",
      "impact": "Q2和Q3的最优检测时点依赖损失函数与风险权重；不同定义可能改变推荐时点。",
      "needs_human_answer": true
    },
    {
      "item": "题目没有明确检测误差是指Y浓度测量误差、孕周误差、重复检测差异，还是综合误差。",
      "impact": "敏感性分析的扰动对象和误差分布需要明确或采用多个情景。",
      "needs_human_answer": true
    },
    {
      "item": "对于观测期内从未达到4%的孕妇，最早达标时间不可直接观测。",
      "impact": "若删除这些记录会产生选择偏差；可能需要删失数据或达标概率方法。",
      "needs_human_answer": false
    },
    {
      "item": "同一次抽血多次检测与多次抽血记录的误差结构可能不同。",
      "impact": "重复测量模型、聚合规则和不确定性估计需区分两种重复来源。",
      "needs_human_answer": false
    },
    {
      "item": "AB列可能以字符串形式列出一种或多种非整倍体，空白代表无异常；需核验实际编码。",
      "impact": "Q4可被定义为总体二分类或13、18、21号染色体多标签分类，两种任务的评价方法不同。",
      "needs_human_answer": true
    },
    {
      "item": "附件样本大多为高BMI孕妇，目标人群和外推范围未明确。",
      "impact": "推荐分组和时点可能只适用于附件代表的人群，低BMI区间结论可能不稳定。",
      "needs_human_answer": false
    }
  ],
  "verifiable_objectives": [
    "Q1模型在按孕妇分组的验证中具有可复现的效应估计、显著性检验和残差诊断",
    "Q2分组和时点在明确风险函数下优于预先声明的统一时点或临床BMI分组基线",
    "Q3多因素方案在按孕妇划分的验证中改善达标概率估计或风险，并报告不确定性",
    "Q2和Q3的推荐在合理测量误差、分组边界和风险权重扰动下保持可解释的稳定性",
    "Q4在按孕妇代码隔离的验证中相对简单Z值规则提供经校准的分类性能，并报告类别不平衡下的灵敏度、特异度和误判情况",
    "所有核心数字、表格、图形和结论均可追溯到冻结实验与Claim Ledger"
  ],
  "dependencies": [
    {
      "from": "Q1",
      "to": "Q2",
      "reason": "Q1对Y染色体浓度、孕周和BMI关系的估计为最早达标时间及BMI分组提供依据。"
    },
    {
      "from": "Q1",
      "to": "Q3",
      "reason": "Q3是在Q1关系模型基础上引入更多孕妇因素、测量误差和达标概率。"
    },
    {
      "from": "Q2",
      "to": "Q3",
      "reason": "Q2提供以BMI分组和时点优化为核心的基线框架，Q3对其进行多因素扩展。"
    }
  ]
}
